<?xml version="1.0" encoding="UTF-8"?>
<!-- edited with XMLSpy v2016 rel. 2 (x64) (http://www.altova.com) by Diogo Remedios (Instituto Superior de Engenharia de Lisboa) -->
<!-- Eng. P, Filipe -->
<xs:schema xmlns:xs="http://www.w3.org/2001/XMLSchema">
	<xs:simpleType name="AT_latLonListType">
		<xs:annotation>
			<xs:documentation>valida pares latitude e longitude
               (i.e. 38.732533,-9.147221)
 </xs:documentation>
		</xs:annotation>
		<xs:restriction base="xs:string">
			<xs:pattern value="[\-]?\d{1,2}\.\d+,[\-]?\d{1,3}\.\d+( [\-]?\d{1,2}\.\d+,[\-]?\d{1,3}\.\d+)*"/>
		</xs:restriction>
	</xs:simpleType>
	<xs:simpleType name="AT_emailAddress">
		<xs:annotation>
			<xs:documentation>valida endereço de email</xs:documentation>
		</xs:annotation>
		<xs:restriction base="xs:string">
			<xs:pattern value="\w+([-+.']\w+)*@\w+([-.]\w+)*\.\w+([-.]\w+)*"/>
		</xs:restriction>
	</xs:simpleType>
	<xs:simpleType name="AT_mime">
		<xs:annotation>
			<xs:documentation>tipo de imagens</xs:documentation>
		</xs:annotation>
		<xs:restriction base="xs:string">
			<xs:enumeration value="image/jpg"/>
			<xs:enumeration value="image/png"/>
			<xs:enumeration value="image/gif"/>
			<xs:enumeration value="image/bmp"/>
		</xs:restriction>
	</xs:simpleType>
	<xs:simpleType name="AT_Dsg">
		<xs:annotation>
			<xs:documentation>padrão aplicado a designações (minusculas)</xs:documentation>
		</xs:annotation>
		<xs:restriction base="xs:string">
			<xs:pattern value="[a-z|áàãâéèíìóòõôúùç ']{1,60}"/>
		</xs:restriction>
	</xs:simpleType>
	<xs:complexType name="AT_Ingrediente">
		<xs:annotation>
			<xs:documentation>tipo associado á definição do ingrediente</xs:documentation>
		</xs:annotation>
		<xs:group ref="lingua"/>
		<xs:attribute name="idingrediente" type="xs:ID" use="required"/>
	</xs:complexType>
	<xs:group name="lingua">
		<xs:annotation>
			<xs:documentation>groupo de elementos que implementa multilingua (não implementa restriçoes de unicidade!)</xs:documentation>
		</xs:annotation>
		<xs:sequence>
			<xs:element name="pt-pt" type="AT_Dsg"/>
			<xs:element name="en-uk" type="AT_Dsg" minOccurs="0"/>
			<xs:element name="fr-fr" type="AT_Dsg" minOccurs="0"/>
		</xs:sequence>
	</xs:group>
	<xs:element name="url" type="xs:anyURI">
		<xs:annotation>
			<xs:documentation>representa um URL (referencia externa)</xs:documentation>
		</xs:annotation>
	</xs:element>
	<xs:element name="serve">
		<xs:annotation>
			<xs:documentation>atribui um preço a um item que figura numa ementa</xs:documentation>
		</xs:annotation>
		<xs:complexType>
			<xs:attribute name="preço" use="required">
				<xs:simpleType>
					<xs:restriction base="xs:decimal">
						<xs:totalDigits value="4"/>
						<xs:fractionDigits value="1"/>
						<xs:minInclusive value="0"/>
					</xs:restriction>
				</xs:simpleType>
			</xs:attribute>
			<xs:attribute name="iditem" type="xs:IDREF" use="required"/>
		</xs:complexType>
	</xs:element>
	<xs:element name="imagem">
		<xs:annotation>
			<xs:documentation>representa uma imagem</xs:documentation>
		</xs:annotation>
		<xs:complexType>
			<xs:simpleContent>
				<xs:extension base="xs:string">
					<xs:attribute name="mime" type="AT_mime" use="required">
						<xs:annotation>
							<xs:documentation>tipo original do ficheiro</xs:documentation>
						</xs:annotation>
					</xs:attribute>
					<xs:attribute name="path" type="xs:anyURI">
						<xs:annotation>
							<xs:documentation>nome/caminho original do ficheirro</xs:documentation>
						</xs:annotation>
					</xs:attribute>
					<xs:attribute name="encoding" type="xs:string" default="xs:base64Binary">
						<xs:annotation>
							<xs:documentation>exemplo: <img src="data:image/jpg;base64,........CONTEUDO EM BASE64......"/>
							</xs:documentation>
						</xs:annotation>
					</xs:attribute>
				</xs:extension>
			</xs:simpleContent>
		</xs:complexType>
	</xs:element>
	<xs:element name="itens">
		<xs:annotation>
			<xs:documentation>representa um conjunto de itens</xs:documentation>
		</xs:annotation>
		<xs:complexType>
			<xs:sequence>
				<xs:element ref="item" maxOccurs="unbounded"/>
			</xs:sequence>
		</xs:complexType>
		<xs:unique name="aken-uk">
			<xs:selector xpath="item/en-uk"/>
			<xs:field xpath="."/>
		</xs:unique>
		<xs:unique name="akfr-fr">
			<xs:selector xpath="item/fr-fr"/>
			<xs:field xpath="."/>
		</xs:unique>
	</xs:element>
	<xs:element name="item">
		<xs:annotation>
			<xs:documentation>representa um item</xs:documentation>
		</xs:annotation>
		<xs:complexType>
			<xs:sequence>
				<xs:group ref="lingua"/>
				<xs:element name="ingrediente" maxOccurs="unbounded">
					<xs:complexType>
						<xs:attribute name="idingrediente" type="xs:IDREF" use="required"/>
					</xs:complexType>
				</xs:element>
				<xs:choice minOccurs="1">
					<xs:element ref="imagem" minOccurs="0"/>
					<xs:element ref="url" minOccurs="0"/>
				</xs:choice>
			</xs:sequence>
			<xs:attribute name="tipo" use="required">
				<xs:simpleType>
					<xs:restriction base="xs:string">
						<xs:enumeration value="entrada"/>
						<xs:enumeration value="carne"/>
						<xs:enumeration value="peixe"/>
						<xs:enumeration value="doce"/>
						<xs:enumeration value="fruta"/>
					</xs:restriction>
				</xs:simpleType>
			</xs:attribute>
			<xs:attribute name="iditem" type="xs:ID" use="required"/>
		</xs:complexType>
		<xs:unique name="akitpt">
			<xs:selector xpath="pt-pt"/>
			<xs:field xpath="."/>
		</xs:unique>
		<xs:unique name="akituk">
			<xs:selector xpath="en-uk"/>
			<xs:field xpath="."/>
		</xs:unique>
		<xs:unique name="akitfr">
			<xs:selector xpath="fr-fr"/>
			<xs:field xpath="."/>
		</xs:unique>
	</xs:element>
	<xs:element name="ingredientes">
		<xs:annotation>
			<xs:documentation>representa um conjunto de ingredientes</xs:documentation>
		</xs:annotation>
		<xs:complexType>
			<xs:sequence>
				<xs:element ref="ingrediente" maxOccurs="unbounded"/>
			</xs:sequence>
		</xs:complexType>
	</xs:element>
	<xs:element name="ingrediente" type="AT_Ingrediente">
		<xs:annotation>
			<xs:documentation>representa um ingrediente</xs:documentation>
		</xs:annotation>
		<xs:unique name="akigpt">
			<xs:selector xpath="pt-pt"/>
			<xs:field xpath="."/>
		</xs:unique>
		<xs:unique name="akiguk">
			<xs:selector xpath="en-uk"/>
			<xs:field xpath="."/>
		</xs:unique>
		<xs:unique name="akigfr">
			<xs:selector xpath="fr-fr"/>
			<xs:field xpath="."/>
		</xs:unique>
	</xs:element>
	<xs:element name="ementas">
		<xs:annotation>
			<xs:documentation>representa um conjunto de ementas</xs:documentation>
		</xs:annotation>
		<xs:complexType>
			<xs:sequence>
				<xs:element ref="ementa" maxOccurs="unbounded"/>
			</xs:sequence>
		</xs:complexType>
	</xs:element>
	<xs:element name="ementa">
		<xs:annotation>
			<xs:documentation>representa uma ementa</xs:documentation>
		</xs:annotation>
		<xs:complexType>
			<xs:sequence>
				<xs:element ref="serve" maxOccurs="unbounded"/>
			</xs:sequence>
			<xs:attribute name="tipo" use="required">
				<xs:simpleType>
					<xs:restriction base="xs:string">
						<xs:enumeration value="almoço"/>
						<xs:enumeration value="jantar"/>
					</xs:restriction>
				</xs:simpleType>
			</xs:attribute>
			<xs:attribute name="modo" use="required">
				<xs:simpleType>
					<xs:restriction base="xs:string">
						<xs:enumeration value="diaútil"/>
						<xs:enumeration value="fds-feriado"/>
					</xs:restriction>
				</xs:simpleType>
			</xs:attribute>
		</xs:complexType>
		<xs:key name="pkserve">
			<xs:selector xpath="serve"/>
			<xs:field xpath="@iditem"/>
		</xs:key>
	</xs:element>
	<xs:element name="restaurante">
		<xs:annotation>
			<xs:documentation>representa um restaurante</xs:documentation>
		</xs:annotation>
		<xs:complexType>
			<xs:sequence>
				<xs:element ref="imagem">
					<xs:annotation>
						<xs:documentation>logotipo</xs:documentation>
					</xs:annotation>
				</xs:element>
				<xs:element ref="ingredientes">
					<xs:annotation>
						<xs:documentation>registo de ingredientes</xs:documentation>
					</xs:annotation>
				</xs:element>
				<xs:element ref="itens">
					<xs:annotation>
						<xs:documentation>registo de itens</xs:documentation>
					</xs:annotation>
				</xs:element>
				<xs:element ref="ementas">
					<xs:annotation>
						<xs:documentation>registo de ementas</xs:documentation>
					</xs:annotation>
				</xs:element>
			</xs:sequence>
			<xs:attribute name="email" type="AT_emailAddress" use="required"/>
			<xs:attribute name="designação" type="AT_Dsg" use="required"/>
			<xs:attribute name="coordenadas" type="AT_latLonListType" default="38.755787,-9.116290"/>
		</xs:complexType>
		<xs:key name="pkitem">
			<xs:selector xpath="itens/item"/>
			<xs:field xpath="@iditem"/>
		</xs:key>
		<xs:keyref name="fkitem" refer="pkitem">
			<xs:selector xpath="ementas/ementa/serve"/>
			<xs:field xpath="@iditem"/>
		</xs:keyref>
		<xs:key name="pkingrediente">
			<xs:selector xpath="ingredientes/ingrediente"/>
			<xs:field xpath="@idingrediente"/>
		</xs:key>
		<xs:keyref name="fkingrediente" refer="pkingrediente">
			<xs:selector xpath="itens/item/ingrediente"/>
			<xs:field xpath="@idingrediente"/>
		</xs:keyref>
	</xs:element>
</xs:schema>
